"No.","Time","Source","Destination","Protocol","Length","Info","Channel","Signal Strength","TCP Payload Size","Packet Size"
"1","0.000000","172.16.254.2","172.16.254.4","TCP","98","30303  >  50700 [PSH, ACK] Seq=1 Ack=1 Win=501 Len=32 TSval=348687409 TSecr=97734338","","","32","98"
"2","0.000006","172.16.254.4","172.16.254.2","TCP","66","50700  >  30303 [ACK] Seq=1 Ack=33 Win=3666 Len=0 TSval=97741279 TSecr=348687409","","","0","66"
"3","0.000031","172.16.254.2","172.16.254.4","TCP","67","30303  >  50700 [PSH, ACK] Seq=33 Ack=1 Win=501 Len=1 TSval=348687409 TSecr=97741279","","","1","67"
"4","0.000033","172.16.254.4","172.16.254.2","TCP","66","50700  >  30303 [ACK] Seq=1 Ack=34 Win=3666 Len=0 TSval=97741279 TSecr=348687409","","","0","66"
"5","0.000041","172.16.254.2","172.16.254.4","TCP","364","30303  >  50700 [PSH, ACK] Seq=34 Ack=1 Win=501 Len=298 TSval=348687409 TSecr=97741279","","","298","364"
"6","0.000042","172.16.254.4","172.16.254.2","TCP","66","50700  >  30303 [ACK] Seq=1 Ack=332 Win=3666 Len=0 TSval=97741279 TSecr=348687409","","","0","66"
"7","0.000058","172.16.254.2","172.16.254.4","TCP","71","30303  >  50700 [PSH, ACK] Seq=332 Ack=1 Win=501 Len=5 TSval=348687409 TSecr=97741279","","","5","71"
"8","0.000060","172.16.254.4","172.16.254.2","TCP","66","50700  >  30303 [ACK] Seq=1 Ack=337 Win=3666 Len=0 TSval=97741279 TSecr=348687409","","","0","66"
"9","0.000074","172.16.254.2","172.16.254.4","TCP","82","30303  >  50700 [PSH, ACK] Seq=337 Ack=1 Win=501 Len=16 TSval=348687409 TSecr=97741279","","","16","82"
"10","0.000076","172.16.254.4","172.16.254.2","TCP","66","50700  >  30303 [ACK] Seq=1 Ack=353 Win=3666 Len=0 TSval=97741279 TSecr=348687409","","","0","66"
"11","0.088094","172.16.254.1","172.16.254.4","TCP","74","41462  >  8545 [SYN] Seq=0 Win=65495 Len=0 MSS=65495 SACK_PERM TSval=2834206085 TSecr=0 WS=128","","","0","74"
"12","0.088176","172.16.254.4","172.16.254.1","TCP","74","8545  >  41462 [SYN, ACK] Seq=0 Ack=1 Win=65160 Len=0 MSS=1460 SACK_PERM TSval=1035282148 TSecr=2834206085 WS=128","","","0","74"
"13","0.088208","172.16.254.1","172.16.254.4","TCP","66","41462  >  8545 [ACK] Seq=1 Ack=1 Win=65536 Len=0 TSval=2834206085 TSecr=1035282148","","","0","66"
"14","0.088540","172.16.254.1","172.16.254.4","HTTP/JSON","280","POST / HTTP/1.1 , JSON (application/json)","","","214","280"
"15","0.088554","172.16.254.4","172.16.254.1","TCP","66","8545  >  41462 [ACK] Seq=1 Ack=215 Win=65024 Len=0 TSval=1035282149 TSecr=2834206086","","","0","66"
"16","0.089414","172.16.254.4","172.16.254.1","HTTP/JSON","854","HTTP/1.1 200 OK , JSON (application/json)","","","788","854"
"17","0.089437","172.16.254.1","172.16.254.4","TCP","66","41462  >  8545 [ACK] Seq=215 Ack=789 Win=64768 Len=0 TSval=2834206087 TSecr=1035282150","","","0","66"
"18","0.089957","172.16.254.1","172.16.254.4","TCP","66","41462  >  8545 [FIN, ACK] Seq=215 Ack=789 Win=65536 Len=0 TSval=2834206087 TSecr=1035282150","","","0","66"
"19","0.090044","172.16.254.4","172.16.254.1","TCP","66","8545  >  41462 [FIN, ACK] Seq=789 Ack=216 Win=65024 Len=0 TSval=1035282150 TSecr=2834206087","","","0","66"
"20","0.090063","172.16.254.1","172.16.254.4","TCP","66","41462  >  8545 [ACK] Seq=216 Ack=790 Win=65536 Len=0 TSval=2834206087 TSecr=1035282150","","","0","66"
"21","4.070003","172.16.254.2","172.16.254.4","TCP","98","30303  >  50700 [PSH, ACK] Seq=353 Ack=1 Win=501 Len=32 TSval=348691479 TSecr=97741279","","","32","98"
"22","4.070013","172.16.254.4","172.16.254.2","TCP","66","50700  >  30303 [ACK] Seq=1 Ack=385 Win=3666 Len=0 TSval=97745349 TSecr=348691479","","","0","66"
"23","4.070039","172.16.254.2","172.16.254.4","TCP","67","30303  >  50700 [PSH, ACK] Seq=385 Ack=1 Win=501 Len=1 TSval=348691479 TSecr=97745349","","","1","67"
"24","4.070041","172.16.254.4","172.16.254.2","TCP","66","50700  >  30303 [ACK] Seq=1 Ack=386 Win=3666 Len=0 TSval=97745349 TSecr=348691479","","","0","66"
"25","4.070059","172.16.254.2","172.16.254.4","TCP","364","30303  >  50700 [PSH, ACK] Seq=386 Ack=1 Win=501 Len=298 TSval=348691479 TSecr=97745349","","","298","364"
"26","4.070061","172.16.254.4","172.16.254.2","TCP","66","50700  >  30303 [ACK] Seq=1 Ack=684 Win=3666 Len=0 TSval=97745349 TSecr=348691479","","","0","66"
"27","4.070072","172.16.254.2","172.16.254.4","TCP","71","30303  >  50700 [PSH, ACK] Seq=684 Ack=1 Win=501 Len=5 TSval=348691479 TSecr=97745349","","","5","71"
"28","4.070074","172.16.254.4","172.16.254.2","TCP","66","50700  >  30303 [ACK] Seq=1 Ack=689 Win=3666 Len=0 TSval=97745349 TSecr=348691479","","","0","66"
"29","4.070084","172.16.254.2","172.16.254.4","TCP","82","30303  >  50700 [PSH, ACK] Seq=689 Ack=1 Win=501 Len=16 TSval=348691479 TSecr=97745349","","","16","82"
"30","4.070085","172.16.254.4","172.16.254.2","TCP","66","50700  >  30303 [ACK] Seq=1 Ack=705 Win=3666 Len=0 TSval=97745349 TSecr=348691479","","","0","66"
"31","5.331262","02:42:ac:10:fe:04","02:42:c6:f9:e8:e7","ARP","42","Who has 172.16.254.1? Tell 172.16.254.4","","","","42"
"32","5.331303","02:42:c6:f9:e8:e7","02:42:ac:10:fe:04","ARP","42","Who has 172.16.254.4? Tell 172.16.254.1","","","","42"
"33","5.331305","02:42:ac:10:fe:04","02:42:c6:f9:e8:e7","ARP","42","172.16.254.4 is at 02:42:ac:10:fe:04","","","","42"
"34","5.331306","02:42:c6:f9:e8:e7","02:42:ac:10:fe:04","ARP","42","172.16.254.1 is at 02:42:c6:f9:e8:e7","","","","42"
"35","6.990239","172.16.254.1","172.16.254.4","TCP","74","41476  >  8545 [SYN] Seq=0 Win=65495 Len=0 MSS=65495 SACK_PERM TSval=2834212988 TSecr=0 WS=128","","","0","74"
"36","6.990280","172.16.254.4","172.16.254.1","TCP","74","8545  >  41476 [SYN, ACK] Seq=0 Ack=1 Win=65160 Len=0 MSS=1460 SACK_PERM TSval=1035289051 TSecr=2834212988 WS=128","","","0","74"
"37","6.990296","172.16.254.1","172.16.254.4","TCP","66","41476  >  8545 [ACK] Seq=1 Ack=1 Win=65536 Len=0 TSval=2834212988 TSecr=1035289051","","","0","66"
"38","6.990434","172.16.254.1","172.16.254.4","HTTP/JSON","284","POST / HTTP/1.1 , JSON (application/json)","","","218","284"
"39","6.990439","172.16.254.4","172.16.254.1","TCP","66","8545  >  41476 [ACK] Seq=1 Ack=219 Win=65024 Len=0 TSval=1035289051 TSecr=2834212988","","","0","66"
"40","6.990743","172.16.254.4","172.16.254.1","HTTP/JSON","230","HTTP/1.1 200 OK , JSON (application/json)","","","164","230"
"41","6.990759","172.16.254.1","172.16.254.4","TCP","66","41476  >  8545 [ACK] Seq=219 Ack=165 Win=65408 Len=0 TSval=2834212988 TSecr=1035289051","","","0","66"
"42","6.991260","172.16.254.1","172.16.254.4","TCP","66","41476  >  8545 [FIN, ACK] Seq=219 Ack=165 Win=65536 Len=0 TSval=2834212989 TSecr=1035289051","","","0","66"
"43","6.991343","172.16.254.4","172.16.254.1","TCP","66","8545  >  41476 [FIN, ACK] Seq=165 Ack=220 Win=65024 Len=0 TSval=1035289052 TSecr=2834212989","","","0","66"
"44","6.991360","172.16.254.1","172.16.254.4","TCP","66","41476  >  8545 [ACK] Seq=220 Ack=166 Win=65536 Len=0 TSval=2834212989 TSecr=1035289052","","","0","66"
"45","7.144658","172.16.254.4","172.16.254.2","TCP","98","50700  >  30303 [PSH, ACK] Seq=1 Ack=705 Win=3666 Len=32 TSval=97748424 TSecr=348691479","","","32","98"
"46","7.144694","172.16.254.2","172.16.254.4","TCP","66","30303  >  50700 [ACK] Seq=705 Ack=33 Win=501 Len=0 TSval=348694554 TSecr=97748424","","","0","66"
"47","7.144705","172.16.254.4","172.16.254.2","TCP","67","50700  >  30303 [PSH, ACK] Seq=33 Ack=705 Win=3666 Len=1 TSval=97748424 TSecr=348694554","","","1","67"
"48","7.144712","172.16.254.2","172.16.254.4","TCP","66","30303  >  50700 [ACK] Seq=705 Ack=34 Win=501 Len=0 TSval=348694554 TSecr=97748424","","","0","66"
"49","7.144717","172.16.254.4","172.16.254.2","TCP","69","50700  >  30303 [PSH, ACK] Seq=34 Ack=705 Win=3666 Len=3 TSval=97748424 TSecr=348694554","","","3","69"
"50","7.144721","172.16.254.2","172.16.254.4","TCP","66","30303  >  50700 [ACK] Seq=705 Ack=37 Win=501 Len=0 TSval=348694554 TSecr=97748424","","","0","66"
"51","7.144726","172.16.254.4","172.16.254.2","TCP","78","50700  >  30303 [PSH, ACK] Seq=37 Ack=705 Win=3666 Len=12 TSval=97748424 TSecr=348694554","","","12","78"
"52","7.144730","172.16.254.2","172.16.254.4","TCP","66","30303  >  50700 [ACK] Seq=705 Ack=49 Win=501 Len=0 TSval=348694554 TSecr=97748424","","","0","66"
"53","7.144737","172.16.254.4","172.16.254.2","TCP","82","50700  >  30303 [PSH, ACK] Seq=49 Ack=705 Win=3666 Len=16 TSval=97748424 TSecr=348694554","","","16","82"
"54","7.144742","172.16.254.2","172.16.254.4","TCP","66","30303  >  50700 [ACK] Seq=705 Ack=65 Win=501 Len=0 TSval=348694554 TSecr=97748424","","","0","66"
"55","7.144889","172.16.254.2","172.16.254.4","TCP","98","30303  >  50700 [PSH, ACK] Seq=705 Ack=65 Win=501 Len=32 TSval=348694554 TSecr=97748424","","","32","98"
"56","7.144892","172.16.254.4","172.16.254.2","TCP","66","50700  >  30303 [ACK] Seq=65 Ack=737 Win=3666 Len=0 TSval=97748424 TSecr=348694554","","","0","66"
"57","7.146211","172.16.254.2","172.16.254.4","TCP","67","30303  >  50700 [PSH, ACK] Seq=737 Ack=65 Win=501 Len=1 TSval=348694556 TSecr=97748424","","","1","67"
"58","7.146229","172.16.254.4","172.16.254.2","TCP","66","50700  >  30303 [ACK] Seq=65 Ack=738 Win=3666 Len=0 TSval=97748426 TSecr=348694556","","","0","66"
"59","7.146290","172.16.254.2","172.16.254.4","TCP","69","30303  >  50700 [PSH, ACK] Seq=738 Ack=65 Win=501 Len=3 TSval=348694556 TSecr=97748426","","","3","69"
"60","7.146297","172.16.254.4","172.16.254.2","TCP","66","50700  >  30303 [ACK] Seq=65 Ack=741 Win=3666 Len=0 TSval=97748426 TSecr=348694556","","","0","66"
"61","7.146326","172.16.254.2","172.16.254.4","TCP","78","30303  >  50700 [PSH, ACK] Seq=741 Ack=65 Win=501 Len=12 TSval=348694556 TSecr=97748426","","","12","78"
"62","7.146331","172.16.254.4","172.16.254.2","TCP","66","50700  >  30303 [ACK] Seq=65 Ack=753 Win=3666 Len=0 TSval=97748426 TSecr=348694556","","","0","66"
"63","7.146381","172.16.254.2","172.16.254.4","TCP","82","30303  >  50700 [PSH, ACK] Seq=753 Ack=65 Win=501 Len=16 TSval=348694556 TSecr=97748426","","","16","82"
"64","7.146387","172.16.254.4","172.16.254.2","TCP","66","50700  >  30303 [ACK] Seq=65 Ack=769 Win=3666 Len=0 TSval=97748426 TSecr=348694556","","","0","66"
"65","7.146534","172.16.254.2","172.16.254.4","TCP","98","30303  >  50700 [PSH, ACK] Seq=769 Ack=65 Win=501 Len=32 TSval=348694556 TSecr=97748426","","","32","98"
"66","7.146542","172.16.254.4","172.16.254.2","TCP","66","50700  >  30303 [ACK] Seq=65 Ack=801 Win=3666 Len=0 TSval=97748426 TSecr=348694556","","","0","66"
"67","7.146685","172.16.254.2","172.16.254.4","TCP","67","30303  >  50700 [PSH, ACK] Seq=801 Ack=65 Win=501 Len=1 TSval=348694556 TSecr=97748426","","","1","67"
"68","7.146694","172.16.254.4","172.16.254.2","TCP","66","50700  >  30303 [ACK] Seq=65 Ack=802 Win=3666 Len=0 TSval=97748426 TSecr=348694556","","","0","66"
"69","7.146723","172.16.254.2","172.16.254.4","TCP","69","30303  >  50700 [PSH, ACK] Seq=802 Ack=65 Win=501 Len=3 TSval=348694556 TSecr=97748426","","","3","69"
"70","7.146744","172.16.254.4","172.16.254.2","TCP","66","50700  >  30303 [ACK] Seq=65 Ack=805 Win=3666 Len=0 TSval=97748426 TSecr=348694556","","","0","66"
"71","7.146761","172.16.254.2","172.16.254.4","TCP","78","30303  >  50700 [PSH, ACK] Seq=805 Ack=65 Win=501 Len=12 TSval=348694556 TSecr=97748426","","","12","78"
"72","7.146763","172.16.254.4","172.16.254.2","TCP","66","50700  >  30303 [ACK] Seq=65 Ack=817 Win=3666 Len=0 TSval=97748426 TSecr=348694556","","","0","66"
"73","7.146777","172.16.254.2","172.16.254.4","TCP","82","30303  >  50700 [PSH, ACK] Seq=817 Ack=65 Win=501 Len=16 TSval=348694556 TSecr=97748426","","","16","82"
"74","7.146779","172.16.254.4","172.16.254.2","TCP","66","50700  >  30303 [ACK] Seq=65 Ack=833 Win=3666 Len=0 TSval=97748426 TSecr=348694556","","","0","66"
"75","7.147300","172.16.254.4","172.16.254.2","TCP","98","50700  >  30303 [PSH, ACK] Seq=65 Ack=833 Win=3666 Len=32 TSval=97748427 TSecr=348694556","","","32","98"
"76","7.147318","172.16.254.4","172.16.254.2","TCP","67","50700  >  30303 [PSH, ACK] Seq=97 Ack=833 Win=3666 Len=1 TSval=97748427 TSecr=348694556","","","1","67"
"77","7.147324","172.16.254.4","172.16.254.2","TCP","69","50700  >  30303 [PSH, ACK] Seq=98 Ack=833 Win=3666 Len=3 TSval=97748427 TSecr=348694556","","","3","69"
"78","7.147332","172.16.254.4","172.16.254.2","TCP","78","50700  >  30303 [PSH, ACK] Seq=101 Ack=833 Win=3666 Len=12 TSval=97748427 TSecr=348694556","","","12","78"
"79","7.147346","172.16.254.4","172.16.254.2","TCP","82","50700  >  30303 [PSH, ACK] Seq=113 Ack=833 Win=3666 Len=16 TSval=97748427 TSecr=348694556","","","16","82"
"80","7.147442","172.16.254.2","172.16.254.4","TCP","66","30303  >  50700 [ACK] Seq=833 Ack=129 Win=501 Len=0 TSval=348694557 TSecr=97748427","","","0","66"
"81","12.970562","172.16.254.1","172.16.254.4","TCP","74","42662  >  8545 [SYN] Seq=0 Win=65495 Len=0 MSS=65495 SACK_PERM TSval=2834218968 TSecr=0 WS=128","","","0","74"
"82","12.970611","172.16.254.4","172.16.254.1","TCP","74","8545  >  42662 [SYN, ACK] Seq=0 Ack=1 Win=65160 Len=0 MSS=1460 SACK_PERM TSval=1035295031 TSecr=2834218968 WS=128","","","0","74"
"83","12.970628","172.16.254.1","172.16.254.4","TCP","66","42662  >  8545 [ACK] Seq=1 Ack=1 Win=65536 Len=0 TSval=2834218968 TSecr=1035295031","","","0","66"
"84","12.970951","172.16.254.1","172.16.254.4","HTTP/JSON","281","POST / HTTP/1.1 , JSON (application/json)","","","215","281"
"85","12.970958","172.16.254.4","172.16.254.1","TCP","66","8545  >  42662 [ACK] Seq=1 Ack=216 Win=65024 Len=0 TSval=1035295032 TSecr=2834218968","","","0","66"
"86","12.971273","172.16.254.4","172.16.254.1","HTTP/JSON","360","HTTP/1.1 200 OK , JSON (application/json)","","","294","360"
"87","12.971291","172.16.254.1","172.16.254.4","TCP","66","42662  >  8545 [ACK] Seq=216 Ack=295 Win=65280 Len=0 TSval=2834218969 TSecr=1035295032","","","0","66"
"88","12.971752","172.16.254.1","172.16.254.4","TCP","66","42662  >  8545 [FIN, ACK] Seq=216 Ack=295 Win=65536 Len=0 TSval=2834218969 TSecr=1035295032","","","0","66"
"89","12.971822","172.16.254.4","172.16.254.1","TCP","66","8545  >  42662 [FIN, ACK] Seq=295 Ack=217 Win=65024 Len=0 TSval=1035295032 TSecr=2834218969","","","0","66"
"90","12.971840","172.16.254.1","172.16.254.4","TCP","66","42662  >  8545 [ACK] Seq=217 Ack=296 Win=65536 Len=0 TSval=2834218969 TSecr=1035295032","","","0","66"
"91","18.269134","172.16.254.2","172.16.254.4","TCP","98","30303  >  50700 [PSH, ACK] Seq=833 Ack=129 Win=501 Len=32 TSval=348705679 TSecr=97748427","","","32","98"
"92","18.269158","172.16.254.4","172.16.254.2","TCP","66","50700  >  30303 [ACK] Seq=129 Ack=865 Win=3666 Len=0 TSval=97759549 TSecr=348705679","","","0","66"
"93","18.269180","172.16.254.2","172.16.254.4","TCP","67","30303  >  50700 [PSH, ACK] Seq=865 Ack=129 Win=501 Len=1 TSval=348705679 TSecr=97759549","","","1","67"
"94","18.269183","172.16.254.4","172.16.254.2","TCP","66","50700  >  30303 [ACK] Seq=129 Ack=866 Win=3666 Len=0 TSval=97759549 TSecr=348705679","","","0","66"
"95","18.269200","172.16.254.2","172.16.254.4","TCP","364","30303  >  50700 [PSH, ACK] Seq=866 Ack=129 Win=501 Len=298 TSval=348705679 TSecr=97759549","","","298","364"
"96","18.269201","172.16.254.4","172.16.254.2","TCP","66","50700  >  30303 [ACK] Seq=129 Ack=1164 Win=3666 Len=0 TSval=97759549 TSecr=348705679","","","0","66"
"97","18.269220","172.16.254.2","172.16.254.4","TCP","71","30303  >  50700 [PSH, ACK] Seq=1164 Ack=129 Win=501 Len=5 TSval=348705679 TSecr=97759549","","","5","71"
"98","18.269222","172.16.254.4","172.16.254.2","TCP","66","50700  >  30303 [ACK] Seq=129 Ack=1169 Win=3666 Len=0 TSval=97759549 TSecr=348705679","","","0","66"
"99","18.269237","172.16.254.2","172.16.254.4","TCP","82","30303  >  50700 [PSH, ACK] Seq=1169 Ack=129 Win=501 Len=16 TSval=348705679 TSecr=97759549","","","16","82"
"100","18.269244","172.16.254.4","172.16.254.2","TCP","66","50700  >  30303 [ACK] Seq=129 Ack=1185 Win=3666 Len=0 TSval=97759549 TSecr=348705679","","","0","66"
"101","18.453140","172.16.254.2","172.16.254.4","TCP","98","30303  >  50700 [PSH, ACK] Seq=1185 Ack=129 Win=501 Len=32 TSval=348705863 TSecr=97759549","","","32","98"
"102","18.453147","172.16.254.4","172.16.254.2","TCP","66","50700  >  30303 [ACK] Seq=129 Ack=1217 Win=3666 Len=0 TSval=97759733 TSecr=348705863","","","0","66"
"103","18.453169","172.16.254.2","172.16.254.4","TCP","67","30303  >  50700 [PSH, ACK] Seq=1217 Ack=129 Win=501 Len=1 TSval=348705863 TSecr=97759733","","","1","67"
"104","18.453171","172.16.254.4","172.16.254.2","TCP","66","50700  >  30303 [ACK] Seq=129 Ack=1218 Win=3666 Len=0 TSval=97759733 TSecr=348705863","","","0","66"
"105","18.453180","172.16.254.2","172.16.254.4","TCP","364","30303  >  50700 [PSH, ACK] Seq=1218 Ack=129 Win=501 Len=298 TSval=348705863 TSecr=97759733","","","298","364"
"106","18.453181","172.16.254.4","172.16.254.2","TCP","66","50700  >  30303 [ACK] Seq=129 Ack=1516 Win=3666 Len=0 TSval=97759733 TSecr=348705863","","","0","66"
"107","18.453190","172.16.254.2","172.16.254.4","TCP","71","30303  >  50700 [PSH, ACK] Seq=1516 Ack=129 Win=501 Len=5 TSval=348705863 TSecr=97759733","","","5","71"
"108","18.453192","172.16.254.4","172.16.254.2","TCP","66","50700  >  30303 [ACK] Seq=129 Ack=1521 Win=3666 Len=0 TSval=97759733 TSecr=348705863","","","0","66"
"109","18.453201","172.16.254.2","172.16.254.4","TCP","82","30303  >  50700 [PSH, ACK] Seq=1521 Ack=129 Win=501 Len=16 TSval=348705863 TSecr=97759733","","","16","82"
"110","18.453202","172.16.254.4","172.16.254.2","TCP","66","50700  >  30303 [ACK] Seq=129 Ack=1537 Win=3666 Len=0 TSval=97759733 TSecr=348705863","","","0","66"
"111","20.149238","172.16.254.2","172.16.254.4","TCP","98","30303  >  50700 [PSH, ACK] Seq=1537 Ack=129 Win=501 Len=32 TSval=348707559 TSecr=97759733","","","32","98"
"112","20.149246","172.16.254.4","172.16.254.2","TCP","66","50700  >  30303 [ACK] Seq=129 Ack=1569 Win=3666 Len=0 TSval=97761429 TSecr=348707559","","","0","66"
"113","20.149273","172.16.254.2","172.16.254.4","TCP","67","30303  >  50700 [PSH, ACK] Seq=1569 Ack=129 Win=501 Len=1 TSval=348707559 TSecr=97761429","","","1","67"
"114","20.149275","172.16.254.4","172.16.254.2","TCP","66","50700  >  30303 [ACK] Seq=129 Ack=1570 Win=3666 Len=0 TSval=97761429 TSecr=348707559","","","0","66"
"115","20.149284","172.16.254.2","172.16.254.4","TCP","364","30303  >  50700 [PSH, ACK] Seq=1570 Ack=129 Win=501 Len=298 TSval=348707559 TSecr=97761429","","","298","364"
"116","20.149286","172.16.254.4","172.16.254.2","TCP","66","50700  >  30303 [ACK] Seq=129 Ack=1868 Win=3666 Len=0 TSval=97761429 TSecr=348707559","","","0","66"
"117","20.149295","172.16.254.2","172.16.254.4","TCP","71","30303  >  50700 [PSH, ACK] Seq=1868 Ack=129 Win=501 Len=5 TSval=348707559 TSecr=97761429","","","5","71"
"118","20.149296","172.16.254.4","172.16.254.2","TCP","66","50700  >  30303 [ACK] Seq=129 Ack=1873 Win=3666 Len=0 TSval=97761429 TSecr=348707559","","","0","66"
"119","20.149306","172.16.254.2","172.16.254.4","TCP","82","30303  >  50700 [PSH, ACK] Seq=1873 Ack=129 Win=501 Len=16 TSval=348707559 TSecr=97761429","","","16","82"
"120","20.149308","172.16.254.4","172.16.254.2","TCP","66","50700  >  30303 [ACK] Seq=129 Ack=1889 Win=3666 Len=0 TSval=97761429 TSecr=348707559","","","0","66"
"121","21.812503","172.16.254.2","172.16.254.4","TCP","98","30303  >  50700 [PSH, ACK] Seq=1889 Ack=129 Win=501 Len=32 TSval=348709222 TSecr=97761429","","","32","98"
"122","21.812510","172.16.254.4","172.16.254.2","TCP","66","50700  >  30303 [ACK] Seq=129 Ack=1921 Win=3666 Len=0 TSval=97763092 TSecr=348709222","","","0","66"
"123","21.812536","172.16.254.2","172.16.254.4","TCP","67","30303  >  50700 [PSH, ACK] Seq=1921 Ack=129 Win=501 Len=1 TSval=348709222 TSecr=97763092","","","1","67"
"124","21.812542","172.16.254.4","172.16.254.2","TCP","66","50700  >  30303 [ACK] Seq=129 Ack=1922 Win=3666 Len=0 TSval=97763092 TSecr=348709222","","","0","66"
"125","21.812554","172.16.254.2","172.16.254.4","TCP","364","30303  >  50700 [PSH, ACK] Seq=1922 Ack=129 Win=501 Len=298 TSval=348709222 TSecr=97763092","","","298","364"
"126","21.812555","172.16.254.4","172.16.254.2","TCP","66","50700  >  30303 [ACK] Seq=129 Ack=2220 Win=3666 Len=0 TSval=97763092 TSecr=348709222","","","0","66"
"127","21.812565","172.16.254.2","172.16.254.4","TCP","71","30303  >  50700 [PSH, ACK] Seq=2220 Ack=129 Win=501 Len=5 TSval=348709222 TSecr=97763092","","","5","71"
"128","21.812573","172.16.254.2","172.16.254.4","TCP","82","30303  >  50700 [PSH, ACK] Seq=2225 Ack=129 Win=501 Len=16 TSval=348709222 TSecr=97763092","","","16","82"
"129","21.812595","172.16.254.4","172.16.254.2","TCP","66","50700  >  30303 [ACK] Seq=129 Ack=2225 Win=3666 Len=0 TSval=97763092 TSecr=348709222","","","0","66"
"130","21.812658","172.16.254.4","172.16.254.2","TCP","66","50700  >  30303 [ACK] Seq=129 Ack=2241 Win=3666 Len=0 TSval=97763092 TSecr=348709222","","","0","66"
"131","22.145876","172.16.254.4","172.16.254.2","TCP","98","50700  >  30303 [PSH, ACK] Seq=129 Ack=2241 Win=3666 Len=32 TSval=97763425 TSecr=348709222","","","32","98"
"132","22.145900","172.16.254.4","172.16.254.2","TCP","67","50700  >  30303 [PSH, ACK] Seq=161 Ack=2241 Win=3666 Len=1 TSval=97763425 TSecr=348709222","","","1","67"
"133","22.145913","172.16.254.4","172.16.254.2","TCP","69","50700  >  30303 [PSH, ACK] Seq=162 Ack=2241 Win=3666 Len=3 TSval=97763425 TSecr=348709222","","","3","69"
"134","22.145919","172.16.254.4","172.16.254.2","TCP","78","50700  >  30303 [PSH, ACK] Seq=165 Ack=2241 Win=3666 Len=12 TSval=97763425 TSecr=348709222","","","12","78"
"135","22.145938","172.16.254.4","172.16.254.2","TCP","82","50700  >  30303 [PSH, ACK] Seq=177 Ack=2241 Win=3666 Len=16 TSval=97763425 TSecr=348709222","","","16","82"
"136","22.145954","172.16.254.2","172.16.254.4","TCP","66","30303  >  50700 [ACK] Seq=2241 Ack=193 Win=501 Len=0 TSval=348709556 TSecr=97763425","","","0","66"
"137","22.145988","172.16.254.2","172.16.254.4","TCP","98","30303  >  50700 [PSH, ACK] Seq=2241 Ack=193 Win=501 Len=32 TSval=348709556 TSecr=97763425","","","32","98"
"138","22.145990","172.16.254.4","172.16.254.2","TCP","66","50700  >  30303 [ACK] Seq=193 Ack=2273 Win=3666 Len=0 TSval=97763426 TSecr=348709556","","","0","66"
"139","22.146007","172.16.254.2","172.16.254.4","TCP","67","30303  >  50700 [PSH, ACK] Seq=2273 Ack=193 Win=501 Len=1 TSval=348709556 TSecr=97763426","","","1","67"
"140","22.146008","172.16.254.4","172.16.254.2","TCP","66","50700  >  30303 [ACK] Seq=193 Ack=2274 Win=3666 Len=0 TSval=97763426 TSecr=348709556","","","0","66"
"141","22.146015","172.16.254.2","172.16.254.4","TCP","69","30303  >  50700 [PSH, ACK] Seq=2274 Ack=193 Win=501 Len=3 TSval=348709556 TSecr=97763426","","","3","69"
"142","22.146017","172.16.254.4","172.16.254.2","TCP","66","50700  >  30303 [ACK] Seq=193 Ack=2277 Win=3666 Len=0 TSval=97763426 TSecr=348709556","","","0","66"
"143","22.146023","172.16.254.2","172.16.254.4","TCP","78","30303  >  50700 [PSH, ACK] Seq=2277 Ack=193 Win=501 Len=12 TSval=348709556 TSecr=97763426","","","12","78"
"144","22.146024","172.16.254.4","172.16.254.2","TCP","66","50700  >  30303 [ACK] Seq=193 Ack=2289 Win=3666 Len=0 TSval=97763426 TSecr=348709556","","","0","66"
"145","22.146035","172.16.254.2","172.16.254.4","TCP","82","30303  >  50700 [PSH, ACK] Seq=2289 Ack=193 Win=501 Len=16 TSval=348709556 TSecr=97763426","","","16","82"
"146","22.146037","172.16.254.4","172.16.254.2","TCP","66","50700  >  30303 [ACK] Seq=193 Ack=2305 Win=3666 Len=0 TSval=97763426 TSecr=348709556","","","0","66"
"147","22.147382","172.16.254.2","172.16.254.4","TCP","98","30303  >  50700 [PSH, ACK] Seq=2305 Ack=193 Win=501 Len=32 TSval=348709557 TSecr=97763426","","","32","98"
"148","22.147384","172.16.254.4","172.16.254.2","TCP","66","50700  >  30303 [ACK] Seq=193 Ack=2337 Win=3666 Len=0 TSval=97763427 TSecr=348709557","","","0","66"
"149","22.147399","172.16.254.2","172.16.254.4","TCP","67","30303  >  50700 [PSH, ACK] Seq=2337 Ack=193 Win=501 Len=1 TSval=348709557 TSecr=97763427","","","1","67"
"150","22.147400","172.16.254.4","172.16.254.2","TCP","66","50700  >  30303 [ACK] Seq=193 Ack=2338 Win=3666 Len=0 TSval=97763427 TSecr=348709557","","","0","66"
"151","22.147407","172.16.254.2","172.16.254.4","TCP","69","30303  >  50700 [PSH, ACK] Seq=2338 Ack=193 Win=501 Len=3 TSval=348709557 TSecr=97763427","","","3","69"
"152","22.147408","172.16.254.4","172.16.254.2","TCP","66","50700  >  30303 [ACK] Seq=193 Ack=2341 Win=3666 Len=0 TSval=97763427 TSecr=348709557","","","0","66"
"153","22.147415","172.16.254.2","172.16.254.4","TCP","78","30303  >  50700 [PSH, ACK] Seq=2341 Ack=193 Win=501 Len=12 TSval=348709557 TSecr=97763427","","","12","78"
"154","22.147416","172.16.254.4","172.16.254.2","TCP","66","50700  >  30303 [ACK] Seq=193 Ack=2353 Win=3666 Len=0 TSval=97763427 TSecr=348709557","","","0","66"
"155","22.147425","172.16.254.2","172.16.254.4","TCP","82","30303  >  50700 [PSH, ACK] Seq=2353 Ack=193 Win=501 Len=16 TSval=348709557 TSecr=97763427","","","16","82"
"156","22.147426","172.16.254.4","172.16.254.2","TCP","66","50700  >  30303 [ACK] Seq=193 Ack=2369 Win=3666 Len=0 TSval=97763427 TSecr=348709557","","","0","66"
"157","22.147477","172.16.254.4","172.16.254.2","TCP","98","50700  >  30303 [PSH, ACK] Seq=193 Ack=2369 Win=3666 Len=32 TSval=97763427 TSecr=348709557","","","32","98"
"158","22.147492","172.16.254.4","172.16.254.2","TCP","67","50700  >  30303 [PSH, ACK] Seq=225 Ack=2369 Win=3666 Len=1 TSval=97763427 TSecr=348709557","","","1","67"
"159","22.147498","172.16.254.4","172.16.254.2","TCP","69","50700  >  30303 [PSH, ACK] Seq=226 Ack=2369 Win=3666 Len=3 TSval=97763427 TSecr=348709557","","","3","69"
"160","22.147505","172.16.254.4","172.16.254.2","TCP","78","50700  >  30303 [PSH, ACK] Seq=229 Ack=2369 Win=3666 Len=12 TSval=97763427 TSecr=348709557","","","12","78"
"161","22.147514","172.16.254.4","172.16.254.2","TCP","82","50700  >  30303 [PSH, ACK] Seq=241 Ack=2369 Win=3666 Len=16 TSval=97763427 TSecr=348709557","","","16","82"
"162","22.147533","172.16.254.2","172.16.254.4","TCP","66","30303  >  50700 [ACK] Seq=2369 Ack=257 Win=501 Len=0 TSval=348709557 TSecr=97763427","","","0","66"
"163","23.666892","172.16.254.2","172.16.254.4","TCP","98","30303  >  50700 [PSH, ACK] Seq=2369 Ack=257 Win=501 Len=32 TSval=348711076 TSecr=97763427","","","32","98"
"164","23.666909","172.16.254.4","172.16.254.2","TCP","66","50700  >  30303 [ACK] Seq=257 Ack=2401 Win=3666 Len=0 TSval=97764946 TSecr=348711076","","","0","66"
"165","23.666926","172.16.254.2","172.16.254.4","TCP","67","30303  >  50700 [PSH, ACK] Seq=2401 Ack=257 Win=501 Len=1 TSval=348711076 TSecr=97764946","","","1","67"
"166","23.666928","172.16.254.4","172.16.254.2","TCP","66","50700  >  30303 [ACK] Seq=257 Ack=2402 Win=3666 Len=0 TSval=97764946 TSecr=348711076","","","0","66"
"167","23.666947","172.16.254.2","172.16.254.4","TCP","364","30303  >  50700 [PSH, ACK] Seq=2402 Ack=257 Win=501 Len=298 TSval=348711077 TSecr=97764946","","","298","364"
"168","23.666949","172.16.254.4","172.16.254.2","TCP","66","50700  >  30303 [ACK] Seq=257 Ack=2700 Win=3666 Len=0 TSval=97764947 TSecr=348711077","","","0","66"
"169","23.666958","172.16.254.2","172.16.254.4","TCP","71","30303  >  50700 [PSH, ACK] Seq=2700 Ack=257 Win=501 Len=5 TSval=348711077 TSecr=97764947","","","5","71"
"170","23.666959","172.16.254.4","172.16.254.2","TCP","66","50700  >  30303 [ACK] Seq=257 Ack=2705 Win=3666 Len=0 TSval=97764947 TSecr=348711077","","","0","66"
"171","23.666970","172.16.254.2","172.16.254.4","TCP","82","30303  >  50700 [PSH, ACK] Seq=2705 Ack=257 Win=501 Len=16 TSval=348711077 TSecr=97764947","","","16","82"
"172","23.666971","172.16.254.4","172.16.254.2","TCP","66","50700  >  30303 [ACK] Seq=257 Ack=2721 Win=3666 Len=0 TSval=97764947 TSecr=348711077","","","0","66"
"173","25.934179","172.16.254.2","172.16.254.4","TCP","98","30303  >  50700 [PSH, ACK] Seq=2721 Ack=257 Win=501 Len=32 TSval=348713344 TSecr=97764947","","","32","98"
"174","25.934187","172.16.254.4","172.16.254.2","TCP","66","50700  >  30303 [ACK] Seq=257 Ack=2753 Win=3666 Len=0 TSval=97767214 TSecr=348713344","","","0","66"
"175","25.934214","172.16.254.2","172.16.254.4","TCP","67","30303  >  50700 [PSH, ACK] Seq=2753 Ack=257 Win=501 Len=1 TSval=348713344 TSecr=97767214","","","1","67"
"176","25.934216","172.16.254.4","172.16.254.2","TCP","66","50700  >  30303 [ACK] Seq=257 Ack=2754 Win=3666 Len=0 TSval=97767214 TSecr=348713344","","","0","66"
"177","25.934226","172.16.254.2","172.16.254.4","TCP","364","30303  >  50700 [PSH, ACK] Seq=2754 Ack=257 Win=501 Len=298 TSval=348713344 TSecr=97767214","","","298","364"
"178","25.934228","172.16.254.4","172.16.254.2","TCP","66","50700  >  30303 [ACK] Seq=257 Ack=3052 Win=3666 Len=0 TSval=97767214 TSecr=348713344","","","0","66"
"179","25.934237","172.16.254.2","172.16.254.4","TCP","71","30303  >  50700 [PSH, ACK] Seq=3052 Ack=257 Win=501 Len=5 TSval=348713344 TSecr=97767214","","","5","71"
"180","25.934238","172.16.254.4","172.16.254.2","TCP","66","50700  >  30303 [ACK] Seq=257 Ack=3057 Win=3666 Len=0 TSval=97767214 TSecr=348713344","","","0","66"
"181","25.934248","172.16.254.2","172.16.254.4","TCP","82","30303  >  50700 [PSH, ACK] Seq=3057 Ack=257 Win=501 Len=16 TSval=348713344 TSecr=97767214","","","16","82"
"182","25.934249","172.16.254.4","172.16.254.2","TCP","66","50700  >  30303 [ACK] Seq=257 Ack=3073 Win=3666 Len=0 TSval=97767214 TSecr=348713344","","","0","66"
"183","27.368167","172.16.254.2","172.16.254.4","TCP","98","30303  >  50700 [PSH, ACK] Seq=3073 Ack=257 Win=501 Len=32 TSval=348714778 TSecr=97767214","","","32","98"
"184","27.368174","172.16.254.4","172.16.254.2","TCP","66","50700  >  30303 [ACK] Seq=257 Ack=3105 Win=3666 Len=0 TSval=97768648 TSecr=348714778","","","0","66"
"185","27.368200","172.16.254.2","172.16.254.4","TCP","67","30303  >  50700 [PSH, ACK] Seq=3105 Ack=257 Win=501 Len=1 TSval=348714778 TSecr=97768648","","","1","67"
"186","27.368203","172.16.254.4","172.16.254.2","TCP","66","50700  >  30303 [ACK] Seq=257 Ack=3106 Win=3666 Len=0 TSval=97768648 TSecr=348714778","","","0","66"
"187","27.368213","172.16.254.2","172.16.254.4","TCP","364","30303  >  50700 [PSH, ACK] Seq=3106 Ack=257 Win=501 Len=298 TSval=348714778 TSecr=97768648","","","298","364"
"188","27.368214","172.16.254.4","172.16.254.2","TCP","66","50700  >  30303 [ACK] Seq=257 Ack=3404 Win=3666 Len=0 TSval=97768648 TSecr=348714778","","","0","66"
"189","27.368223","172.16.254.2","172.16.254.4","TCP","71","30303  >  50700 [PSH, ACK] Seq=3404 Ack=257 Win=501 Len=5 TSval=348714778 TSecr=97768648","","","5","71"
"190","27.368225","172.16.254.4","172.16.254.2","TCP","66","50700  >  30303 [ACK] Seq=257 Ack=3409 Win=3666 Len=0 TSval=97768648 TSecr=348714778","","","0","66"
"191","27.368236","172.16.254.2","172.16.254.4","TCP","82","30303  >  50700 [PSH, ACK] Seq=3409 Ack=257 Win=501 Len=16 TSval=348714778 TSecr=97768648","","","16","82"
"192","27.368237","172.16.254.4","172.16.254.2","TCP","66","50700  >  30303 [ACK] Seq=257 Ack=3425 Win=3666 Len=0 TSval=97768648 TSecr=348714778","","","0","66"
"193","29.475502","172.16.254.2","172.16.254.4","TCP","98","30303  >  50700 [PSH, ACK] Seq=3425 Ack=257 Win=501 Len=32 TSval=348716885 TSecr=97768648","","","32","98"
"194","29.475509","172.16.254.4","172.16.254.2","TCP","66","50700  >  30303 [ACK] Seq=257 Ack=3457 Win=3666 Len=0 TSval=97770755 TSecr=348716885","","","0","66"
"195","29.475540","172.16.254.2","172.16.254.4","TCP","67","30303  >  50700 [PSH, ACK] Seq=3457 Ack=257 Win=501 Len=1 TSval=348716885 TSecr=97770755","","","1","67"
"196","29.475543","172.16.254.4","172.16.254.2","TCP","66","50700  >  30303 [ACK] Seq=257 Ack=3458 Win=3666 Len=0 TSval=97770755 TSecr=348716885","","","0","66"
"197","29.475558","172.16.254.2","172.16.254.4","TCP","364","30303  >  50700 [PSH, ACK] Seq=3458 Ack=257 Win=501 Len=298 TSval=348716885 TSecr=97770755","","","298","364"
"198","29.475560","172.16.254.4","172.16.254.2","TCP","66","50700  >  30303 [ACK] Seq=257 Ack=3756 Win=3666 Len=0 TSval=97770755 TSecr=348716885","","","0","66"
"199","29.475571","172.16.254.2","172.16.254.4","TCP","71","30303  >  50700 [PSH, ACK] Seq=3756 Ack=257 Win=501 Len=5 TSval=348716885 TSecr=97770755","","","5","71"
"200","29.475572","172.16.254.4","172.16.254.2","TCP","66","50700  >  30303 [ACK] Seq=257 Ack=3761 Win=3666 Len=0 TSval=97770755 TSecr=348716885","","","0","66"
"201","29.475582","172.16.254.2","172.16.254.4","TCP","82","30303  >  50700 [PSH, ACK] Seq=3761 Ack=257 Win=501 Len=16 TSval=348716885 TSecr=97770755","","","16","82"
"202","29.475584","172.16.254.4","172.16.254.2","TCP","66","50700  >  30303 [ACK] Seq=257 Ack=3777 Win=3666 Len=0 TSval=97770755 TSecr=348716885","","","0","66"
"203","30.485358","172.16.254.2","172.16.254.4","TCP","98","30303  >  50700 [PSH, ACK] Seq=3777 Ack=257 Win=501 Len=32 TSval=348717895 TSecr=97770755","","","32","98"
"204","30.485365","172.16.254.4","172.16.254.2","TCP","66","50700  >  30303 [ACK] Seq=257 Ack=3809 Win=3666 Len=0 TSval=97771765 TSecr=348717895","","","0","66"
"205","30.485391","172.16.254.2","172.16.254.4","TCP","67","30303  >  50700 [PSH, ACK] Seq=3809 Ack=257 Win=501 Len=1 TSval=348717895 TSecr=97771765","","","1","67"
"206","30.485400","172.16.254.4","172.16.254.2","TCP","66","50700  >  30303 [ACK] Seq=257 Ack=3810 Win=3666 Len=0 TSval=97771765 TSecr=348717895","","","0","66"
"207","30.485415","172.16.254.2","172.16.254.4","TCP","364","30303  >  50700 [PSH, ACK] Seq=3810 Ack=257 Win=501 Len=298 TSval=348717895 TSecr=97771765","","","298","364"
"208","30.485416","172.16.254.4","172.16.254.2","TCP","66","50700  >  30303 [ACK] Seq=257 Ack=4108 Win=3666 Len=0 TSval=97771765 TSecr=348717895","","","0","66"
"209","30.485426","172.16.254.2","172.16.254.4","TCP","71","30303  >  50700 [PSH, ACK] Seq=4108 Ack=257 Win=501 Len=5 TSval=348717895 TSecr=97771765","","","5","71"
"210","30.485427","172.16.254.4","172.16.254.2","TCP","66","50700  >  30303 [ACK] Seq=257 Ack=4113 Win=3666 Len=0 TSval=97771765 TSecr=348717895","","","0","66"
"211","30.485437","172.16.254.2","172.16.254.4","TCP","82","30303  >  50700 [PSH, ACK] Seq=4113 Ack=257 Win=501 Len=16 TSval=348717895 TSecr=97771765","","","16","82"
"212","30.485438","172.16.254.4","172.16.254.2","TCP","66","50700  >  30303 [ACK] Seq=257 Ack=4129 Win=3666 Len=0 TSval=97771765 TSecr=348717895","","","0","66"
"213","34.739398","172.16.254.1","172.16.254.4","TCP","74","57028  >  8545 [SYN] Seq=0 Win=65495 Len=0 MSS=65495 SACK_PERM TSval=2834240737 TSecr=0 WS=128","","","0","74"
"214","34.739445","172.16.254.4","172.16.254.1","TCP","74","8545  >  57028 [SYN, ACK] Seq=0 Ack=1 Win=65160 Len=0 MSS=1460 SACK_PERM TSval=1035316800 TSecr=2834240737 WS=128","","","0","74"
"215","34.739467","172.16.254.1","172.16.254.4","TCP","66","57028  >  8545 [ACK] Seq=1 Ack=1 Win=65536 Len=0 TSval=2834240737 TSecr=1035316800","","","0","66"
"216","34.739590","172.16.254.1","172.16.254.4","HTTP/JSON","360","POST / HTTP/1.1 , JSON (application/json)","","","294","360"
"217","34.739598","172.16.254.4","172.16.254.1","TCP","66","8545  >  57028 [ACK] Seq=1 Ack=295 Win=64896 Len=0 TSval=1035316800 TSecr=2834240737","","","0","66"
"218","34.740436","172.16.254.4","172.16.254.1","HTTP/JSON","245","HTTP/1.1 200 OK , JSON (application/json)","","","179","245"
"219","34.740454","172.16.254.1","172.16.254.4","TCP","66","57028  >  8545 [ACK] Seq=295 Ack=180 Win=65408 Len=0 TSval=2834240738 TSecr=1035316801","","","0","66"
"220","34.740882","172.16.254.1","172.16.254.4","TCP","66","57028  >  8545 [FIN, ACK] Seq=295 Ack=180 Win=65536 Len=0 TSval=2834240738 TSecr=1035316801","","","0","66"
"221","34.740971","172.16.254.4","172.16.254.1","TCP","66","8545  >  57028 [FIN, ACK] Seq=180 Ack=296 Win=64896 Len=0 TSval=1035316802 TSecr=2834240738","","","0","66"
"222","34.740995","172.16.254.1","172.16.254.4","TCP","66","57028  >  8545 [ACK] Seq=296 Ack=181 Win=65536 Len=0 TSval=2834240739 TSecr=1035316802","","","0","66"
"223","35.553088","172.16.254.2","172.16.254.4","TCP","98","30303  >  50700 [PSH, ACK] Seq=4129 Ack=257 Win=501 Len=32 TSval=348722963 TSecr=97771765","","","32","98"
"224","35.553101","172.16.254.4","172.16.254.2","TCP","66","50700  >  30303 [ACK] Seq=257 Ack=4161 Win=3666 Len=0 TSval=97776833 TSecr=348722963","","","0","66"
"225","35.553136","172.16.254.2","172.16.254.4","TCP","67","30303  >  50700 [PSH, ACK] Seq=4161 Ack=257 Win=501 Len=1 TSval=348722963 TSecr=97776833","","","1","67"
"226","35.553138","172.16.254.4","172.16.254.2","TCP","66","50700  >  30303 [ACK] Seq=257 Ack=4162 Win=3666 Len=0 TSval=97776833 TSecr=348722963","","","0","66"
"227","35.553157","172.16.254.2","172.16.254.4","TCP","364","30303  >  50700 [PSH, ACK] Seq=4162 Ack=257 Win=501 Len=298 TSval=348722963 TSecr=97776833","","","298","364"
"228","35.553159","172.16.254.4","172.16.254.2","TCP","66","50700  >  30303 [ACK] Seq=257 Ack=4460 Win=3666 Len=0 TSval=97776833 TSecr=348722963","","","0","66"
"229","35.553174","172.16.254.2","172.16.254.4","TCP","71","30303  >  50700 [PSH, ACK] Seq=4460 Ack=257 Win=501 Len=5 TSval=348722963 TSecr=97776833","","","5","71"
"230","35.553177","172.16.254.4","172.16.254.2","TCP","66","50700  >  30303 [ACK] Seq=257 Ack=4465 Win=3666 Len=0 TSval=97776833 TSecr=348722963","","","0","66"
"231","35.553238","172.16.254.2","172.16.254.4","TCP","82","30303  >  50700 [PSH, ACK] Seq=4465 Ack=257 Win=501 Len=16 TSval=348722963 TSecr=97776833","","","16","82"
"232","35.553240","172.16.254.4","172.16.254.2","TCP","66","50700  >  30303 [ACK] Seq=257 Ack=4481 Win=3666 Len=0 TSval=97776833 TSecr=348722963","","","0","66"
"233","36.129796","172.16.254.2","172.16.254.4","TCP","98","30303  >  50700 [PSH, ACK] Seq=4481 Ack=257 Win=501 Len=32 TSval=348723539 TSecr=97776833","","","32","98"
"234","36.129805","172.16.254.4","172.16.254.2","TCP","66","50700  >  30303 [ACK] Seq=257 Ack=4513 Win=3666 Len=0 TSval=97777409 TSecr=348723539","","","0","66"
"235","36.129834","172.16.254.2","172.16.254.4","TCP","67","30303  >  50700 [PSH, ACK] Seq=4513 Ack=257 Win=501 Len=1 TSval=348723539 TSecr=97777409","","","1","67"
"236","36.129837","172.16.254.4","172.16.254.2","TCP","66","50700  >  30303 [ACK] Seq=257 Ack=4514 Win=3666 Len=0 TSval=97777409 TSecr=348723539","","","0","66"
"237","36.129856","172.16.254.2","172.16.254.4","TCP","364","30303  >  50700 [PSH, ACK] Seq=4514 Ack=257 Win=501 Len=298 TSval=348723539 TSecr=97777409","","","298","364"
"238","36.129858","172.16.254.4","172.16.254.2","TCP","66","50700  >  30303 [ACK] Seq=257 Ack=4812 Win=3666 Len=0 TSval=97777409 TSecr=348723539","","","0","66"
"239","36.129868","172.16.254.2","172.16.254.4","TCP","71","30303  >  50700 [PSH, ACK] Seq=4812 Ack=257 Win=501 Len=5 TSval=348723539 TSecr=97777409","","","5","71"
"240","36.129870","172.16.254.4","172.16.254.2","TCP","66","50700  >  30303 [ACK] Seq=257 Ack=4817 Win=3666 Len=0 TSval=97777409 TSecr=348723539","","","0","66"
"241","36.129886","172.16.254.2","172.16.254.4","TCP","82","30303  >  50700 [PSH, ACK] Seq=4817 Ack=257 Win=501 Len=16 TSval=348723539 TSecr=97777409","","","16","82"
"242","36.129890","172.16.254.4","172.16.254.2","TCP","66","50700  >  30303 [ACK] Seq=257 Ack=4833 Win=3666 Len=0 TSval=97777409 TSecr=348723539","","","0","66"
"243","37.146124","172.16.254.4","172.16.254.2","TCP","98","50700  >  30303 [PSH, ACK] Seq=257 Ack=4833 Win=3666 Len=32 TSval=97778426 TSecr=348723539","","","32","98"
"244","37.146146","172.16.254.4","172.16.254.2","TCP","67","50700  >  30303 [PSH, ACK] Seq=289 Ack=4833 Win=3666 Len=1 TSval=97778426 TSecr=348723539","","","1","67"
"245","37.146153","172.16.254.4","172.16.254.2","TCP","69","50700  >  30303 [PSH, ACK] Seq=290 Ack=4833 Win=3666 Len=3 TSval=97778426 TSecr=348723539","","","3","69"
"246","37.146161","172.16.254.4","172.16.254.2","TCP","78","50700  >  30303 [PSH, ACK] Seq=293 Ack=4833 Win=3666 Len=12 TSval=97778426 TSecr=348723539","","","12","78"
